{
  "schema_version": 1,
  "generated_at": "2026-09-06T08:17:32.773Z",
  "word_count": 105,
  "words": [
    {
      "word": "acquaint",
      "mw_entry_id": "acquaint",
      "mw_unit_id": "2",
      "definition": {
        "text": "to make familiar : to cause to know firsthand",
        "part_of_speech": "verb",
        "source": "mw-collegiate"
      },
      "hints": {
        "synonym": {
          "text": "familiarize",
          "source": "llm-generated"
        },
        "clue": {
          "text": "To introduce someone to a subject so they know it firsthand.",
          "source": "llm-generated"
        }
      },
      "pronunciation": {
        "mw": "ə-ˈkwānt",
        "audio_file": "acquai01",
        "audio_url": "https://media.merriam-webster.com/audio/prons/en/us/mp3/a/acquai01.mp3"
      },
      "example": null,
      "explanation": {
        "text": "This verb means giving someone their first direct knowledge of something. You might do it with a new city, a new job, or an unfamiliar set of rules.",
        "provenance": "llm-generated"
      },
      "image": {
        "key": "paintings/acquaint.webp",
        "origin": "2023-dalle2",
        "provenance": "recovered",
        "generation": null
      }
    },
    {
      "word": "activity",
      "mw_entry_id": "activity",
      "mw_unit_id": "2",
      "definition": {
        "text": "vigorous or energetic action : liveliness",
        "part_of_speech": "noun",
        "source": "mw-collegiate"
      },
      "hints": {
        "synonym": {
          "text": "liveliness",
          "source": "llm-generated"
        },
        "clue": {
          "text": "The busy, energetic motion of a place that is far from still.",
          "source": "llm-generated"
        }
      },
      "pronunciation": {
        "mw": "ak-ˈti-və-tē",
        "audio_file": "activi04",
        "audio_url": "https://media.merriam-webster.com/audio/prons/en/us/mp3/a/activi04.mp3"
      },
      "example": null,
      "explanation": {
        "text": "In this sense the word means vigorous movement or bustle rather than one particular task. A crowded market at midday is full of it.",
        "provenance": "llm-generated"
      },
      "image": {
        "key": "paintings/activity.webp",
        "origin": "2023-dalle2",
        "provenance": "recovered",
        "generation": null
      }
    },
    {
      "word": "admonish",
      "mw_entry_id": "admonish",
      "mw_unit_id": "1b",
      "definition": {
        "text": "to express warning or disapproval to (someone) about a fault or oversight especially in a gentle but serious way",
        "part_of_speech": "verb",
        "source": "mw-collegiate"
      },
      "hints": {
        "synonym": {
          "text": "reprove",
          "source": "llm-generated"
        },
        "clue": {
          "text": "To warn someone gently but seriously about a fault or oversight.",
          "source": "llm-generated"
        }
      },
      "pronunciation": {
        "mw": "ad-ˈmä-nish",
        "audio_file": "admoni01",
        "audio_url": "https://media.merriam-webster.com/audio/prons/en/us/mp3/a/admoni01.mp3"
      },
      "example": null,
      "explanation": {
        "text": "This is a mild but earnest correction, not an angry telling-off. A teacher might do this to a pupil who keeps forgetting homework.",
        "provenance": "llm-generated"
      },
      "image": {
        "key": "paintings/admonish.webp",
        "origin": "2023-dalle2",
        "provenance": "recovered",
        "generation": null
      }
    },
    {
      "word": "adventure",
      "mw_entry_id": "adventure:1",
      "mw_unit_id": "2",
      "definition": {
        "text": "an exciting or remarkable experience",
        "part_of_speech": "noun",
        "source": "mw-collegiate"
      },
      "hints": {
        "synonym": {
          "text": "escapade",
          "source": "llm-generated"
        },
        "clue": {
          "text": "An exciting or remarkable experience, often involving travel and risk.",
          "source": "llm-generated"
        }
      },
      "pronunciation": {
        "mw": "əd-ˈven-chər",
        "audio_file": "advent08",
        "audio_url": "https://media.merriam-webster.com/audio/prons/en/us/mp3/a/advent08.mp3"
      },
      "example": null,
      "explanation": {
        "text": "The word names an experience worth retelling because it was thrilling or unusual. It suggests something out of the ordinary rather than everyday routine.",
        "provenance": "llm-generated"
      },
      "image": {
        "key": "paintings/adventure.webp",
        "origin": "2023-dalle2",
        "provenance": "recovered",
        "generation": null
      }
    },
    {
      "word": "ambitious",
      "mw_entry_id": "ambitious",
      "mw_unit_id": "1a",
      "definition": {
        "text": "having or controlled by ambition : having a desire to be successful, powerful, or famous",
        "part_of_speech": "adjective",
        "source": "mw-collegiate"
      },
      "hints": {
        "synonym": {
          "text": "aspiring",
          "source": "llm-generated"
        },
        "clue": {
          "text": "Driven by a strong wish to succeed, gain power, or become famous.",
          "source": "llm-generated"
        }
      },
      "pronunciation": {
        "mw": "am-ˈbi-shəs",
        "audio_file": "ambiti03",
        "audio_url": "https://media.merriam-webster.com/audio/prons/en/us/mp3/a/ambiti03.mp3"
      },
      "example": null,
      "explanation": {
        "text": "This describes a person shaped by a hunger for achievement. It can be admiring or slightly critical, depending on how far the hunger goes.",
        "provenance": "llm-generated"
      },
      "image": {
        "key": "paintings/ambitious.webp",
        "origin": "2023-dalle2",
        "provenance": "recovered",
        "generation": null
      }
    },
    {
      "word": "ambivalent",
      "mw_entry_id": "ambivalent",
      "mw_unit_id": "1",
      "definition": {
        "text": "having or showing simultaneous and contradictory attitudes or feelings toward something or someone : characterized by ambivalence",
        "part_of_speech": "adjective",
        "source": "mw-collegiate"
      },
      "hints": {
        "synonym": {
          "text": "of two minds",
          "source": "llm-generated"
        },
        "clue": {
          "text": "Holding two opposite feelings about the same thing at once.",
          "source": "llm-generated"
        }
      },
      "pronunciation": {
        "mw": "am-ˈbi-və-lənt",
        "audio_file": "ambiva02",
        "audio_url": "https://media.merriam-webster.com/audio/prons/en/us/mp3/a/ambiva02.mp3"
      },
      "example": {
        "text": "… people whose relationship to their job is ambivalent, conflicted.",
        "kind": "vis",
        "form_matched": "ambivalent",
        "attribution": {
          "author": "Terrence Rafferty",
          "source": null,
          "date": null
        }
      },
      "explanation": {
        "text": "The word describes genuinely mixed feelings, not simple indifference. In the dictionary example it pairs with \"conflicted\" to describe how someone feels about their job.",
        "provenance": "llm-generated"
      },
      "image": {
        "key": "paintings/ambivalent.webp",
        "origin": "2023-dalle2",
        "provenance": "recovered",
        "generation": null
      }
    },
    {
      "word": "architect",
      "mw_entry_id": "architect",
      "mw_unit_id": "1",
      "definition": {
        "text": "a person who designs buildings and advises in their construction",
        "part_of_speech": "noun",
        "source": "mw-collegiate"
      },
      "hints": {
        "synonym": {
          "text": "designer",
          "source": "llm-generated"
        },
        "clue": {
          "text": "The professional who plans a building and advises on its construction.",
          "source": "llm-generated"
        }
      },
      "pronunciation": {
        "mw": "ˈär-kə-ˌtekt",
        "audio_file": "archit01",
        "audio_url": "https://media.merriam-webster.com/audio/prons/en/us/mp3/a/archit01.mp3"
      },
      "example": null,
      "explanation": {
        "text": "This person designs structures and guides how they get built. The word is also used figuratively for whoever devised a plan or system.",
        "provenance": "llm-generated"
      },
      "image": {
        "key": "paintings/architect.webp",
        "origin": "2023-dalle2",
        "provenance": "recovered",
        "generation": null
      }
    },
    {
      "word": "atlantis",
      "mw_entry_id": "Atlantis",
      "mw_unit_id": "1",
      "definition": {
        "text": "a fabled island in the Atlantic that according to legend sank beneath the sea",
        "part_of_speech": "noun",
        "source": "mw-collegiate"
      },
      "hints": {
        "synonym": {
          "text": "sunken realm",
          "source": "llm-generated"
        },
        "clue": {
          "text": "A legendary island said to have vanished beneath the waves long ago.",
          "source": "llm-generated"
        }
      },
      "pronunciation": {
        "mw": "ət-ˈlan-təs",
        "audio_file": "atlant06",
        "audio_url": "https://media.merriam-webster.com/audio/prons/en/us/mp3/a/atlant06.mp3"
      },
      "example": null,
      "explanation": {
        "text": "This is a fabled island from ancient legend, believed to have sunk into the ocean. It has become a byword for any lost civilisation.",
        "provenance": "llm-generated"
      },
      "image": {
        "key": "paintings/atlantis.webp",
        "origin": "2023-dalle2",
        "provenance": "recovered",
        "generation": null
      }
    },
    {
      "word": "available",
      "mw_entry_id": "available",
      "mw_unit_id": "2a",
      "definition": {
        "text": "accessible, obtainable",